,기사제목,본문url,기사본문,date
30,"디지털자산기본법 여당안, 또 지연…지분 규제 '불확실성'",https://n.news.naver.com/mnews/article/648/0000044724,"민주당 TF 자문위원단 비공개 회의""금융위 지분규제 입장 확고‥절충 필요""



더불어민주당 디지털자산 TF가 24일 서울 여의도 국회에서 자문위원 회의를 열고 디지털자산기본법을 논의하고 있다./사진=백지현 기자여당이 가상자산 2단계 입법안 확정을 3월 초로 미뤘다. 당국과 업계 간 이견이 큰 쟁점사안인 대주주 지분 규제와 스테이블 코인 발행자격에 대한 내용을 재검토하면서다. 업계에서 민감해 하는 소유 분산에 관한 내용이 여전히 미궁에 빠져 거래소들의 인수합병 추진도 불확실성에 놓였다.  대주주 지분 규제 둘러싼 이견 여전더불어민주당 디지털자산 TF는 24일 오후 서울 여의도 국회의원회관에서 자문위원들과 비공개 회의를 열고 디지털자산기본법 입법안을 검토했다.당초 최종안이 이번 회의를 통해 나올 것으로 기대했지만 대주주 지분 규제와 스테이블 코인 발행자격 등 쟁점 사안에 다양한 의견이 나오면서 입법안을 확정짓지 못했다. 이에 따라 TF는 일주일 여의 시간을 갖고 검토한 뒤 절충안을 마련해 당 지도부에 제출할 방침이다. 이정문 TF 위원장은 회의 후 기자들과 만나 ""필리버스터 정국 중에 입법을 할지, 끝나고 할지 고민해봐야 한다""며 ""내부적으로 정리할 물리적 시간이 필요해 이번 주 중으로 결론을 내긴 어렵다""고 말했다. 안도걸 의원은 ""(이번 회의에서) 놓치고 있던 부분, 보완을 해야하는 부분이 발생해 TF 법안 내용의 수정이 필요하다""며 ""(두 가지 쟁점 사안에 대해) 자문위원들이 시장의 의견을 가감없이 전달해줬고 아이디어를 내준 분도 있었다""고 말했다. 그러면서 ""어느정도 결론이 나면 당 지도부와 논의할 것""이라고 덧붙였다. 최종안에선 쟁점 사안들이 아예 빠질 가능성도 염두에 뒀다. 안 의원은 ""이번 법안으로 완성이 되는 건 아니고 향후 시장의 변화가 있다면 2단계, 3단계 입법이 계속될 수 밖에없다""며 ""중요한 것은 빨리 제도화를 하는 것이고 타협이 필요한 시점이라는데 위원들도 동의했다""고 말했다. 이정문 위원장은 ""금융위원회와 각을 세워 우리 입장만 고집한다고 해서 입법이 되는 건 아니기 때문에 고민을 하고 있다""고 말했다.  앞서 금융위는 자본시장법상 대체거래소(ATS)와 같이 코인거래소의 대주주 지분도 15~20%로 제한하는 안을 제시한 바있다. 이에 대해 업계를 비롯해 야당과 여당 TF 자문위원회에서도 비합리적 규제라는 비판이 쏟아진 가운데 여당이 숙고에 들어갔다. 거래소 M&A 풍전등화결국 대주주 지분 규제가 법안이나 시행령을 통해 입법화될 불씨는 살아있다. 지난 23일에도 권대영 부위원장 주재로 업비트·빗썸·코인원·코빗·고팍스 등 5대 원화마켓 거래소와 디지털자산거래소공동협의체(DAXA)를 소집해 의견 수렴에 나서는 등 사실상 대주주 지분 규제를 정부안에 담는 것을 확정한 것으로 알려졌다.안 의원은 ""정부 입장은 확고한 건 맞다""며 ""금융당국 입장에선 혁신을 이뤄야하지만 예측가능하고 질서가있는 모양새로 갔으면 한다""고 말했다. 이어 ""혁신을 향한 방법론의 차이""라고 설명했다.최근 발생한 빗썸 사고가 규제 추진에 명분을 부여했다는 평가도 나온다. 빗썸이 이달 이벤트를 진행하다가 62조원 상당의 비트코인을 오지급하는 사고가 발생했는데 가장 큰 배경으로 내부통제 미흡이 꼽힌다. 이에 정치권에서는 대주주 지분규제를 비롯한 금융회사에 준하는 규제가 필요하다는 목소리가 나온다.  점유율에 따라 대주주 지분 규제 상한을 다르게 적용하는 차등규제도 또 하나의 완충안으로 검토되고 있다. 금융당국 관계자는 ""여당에서 나온 얘기인만큼 검토 대상""이라고 말했다.   이로인해 거래소들이 진행하는 인수합병(M&A) 진행상황도 타격이 불가피해졌다. 두나무는 네이버파이낸셜과 포괄적 주식교환을 통해 합병을 추진하고 있다. 포괄적 주식교환 절차를 완수하면 네이버파이낸셜은 두나무의 지분 100%를 보유하게 된다.코빗도 지배구조 개편을 진행하고 있다. 미래에셋컨설팅은 최근 코빗의 1대주주인 NXC(60.51%)와 2대주주인 SK스퀘어(31.55%)로부터 지분을 인수해 총 92.06%의 지분율로 최대주주에 등극할 것을 예고했다. 이보다 앞서 고팍스 운영사인 스트리미의 경우엔 임원 변경신고를 완료해 글로벌 가상자산거래소인 바이낸스가 67.45%를 가지고 있다. 그러나 이번 규제가 시행되면 이들 기관이 계획대로 지분을 보유하고 경영권을 휘두르는 것이 불가능해진다. 사실상 기관들이 지분 매입으로 기대한 사업적 시너지가 반감될 수밖에없다. 가상자산업계 관계자는 ""국내회사와 인수합병은 당국 신고가 필요한 사안인데 규제와 관련된 이슈가 있다보니 분위기를 살필 필요가 있다""고 말했다.",2026-02-24
31,퇴직연금 코스피로 대이동…주식 실적배당형에 65% 집중,https://n.news.naver.com/mnews/article/009/0005641431,"주식 실적배당형에 65% 집중2년 만에 원리금보장형 추월사상 첫 20만전자·100만닉스5천피 한달 만에 6천피 ‘턱밑’



 코스피가 종가 기준 최고치를 또 한 번 경신한 24일 서울 중구 우리은행 본점 딜링룸 전광판에 코스피 종가가 표시되어 있다. [한주형 기자]코스피가 5000선을 돌파한 지 불과 한 달 만에 6000선 턱밑까지 다가섰다. 24일 코스피는 전일 대비 2.11% 오른 5969.64로 마감했다.시가총액 1위 삼성전자는 3.63% 오른 20만원으로 마감하며 역사상 처음으로 20만원 고지에 올랐다. SK하이닉스도 5.68% 오른 100만5000원을 기록하며 마침내 100만원 선을 돌파했다.이날도 주가 상승의 선봉에는 상장지수펀드(ETF) 자금이 자리했다. 개인과 외국인이 순매도에 나섰지만 금융투자 부문(증권사 등)은 코스피에서만 2조원 이상을 순매수했다. 올해 들어 금융투자에서만 15조원 규모의 순매수가 이뤄졌다.



이런 가운데 퇴직연금에서도 자금 유입이 지속되면서 코스피 질주의 지원군 역할을 하고 있다.지난해 하반기부터 국내 증시가 강세를 보이면서 ‘연금개미’들이 상승장 효과를 누리기 위해 원리금 보장 상품 대신 ETF 같은 실적배당형 상품 비중을 빠르게 늘리고 있는 것으로 나타났다.이날 매일경제가 미래에셋증권에 의뢰해 이 회사가 운영하는 퇴직연금(DC·IRP) 계좌를 분석한 결과 시장 수익률에 따라 성과가 달라지는 실적배당형 상품 비중은 지난달 말 65%까지 상승했다.반면 원리금 보장 상품의 투자 비중은 지난해 말 38.1%에서 35%로 낮아졌다. 불과 한 달 만에 3%포인트 이상 줄어든 셈이다. 2023년 말에는 60%에 육박했던 점을 감안하면 2년여 만에 절반 가까이 감소했다.미래에셋증권 관계자는 “새롭게 유입된 자금 대부분이 실적배당형 상품으로 유입되고 있다”고 설명했다.연금개미의 투자 패턴이 뒤바뀐 것은 시중금리와 연동되는 예금 보장 상품의 수익률이 연 2~3% 수준에 그치며 ETF 등 실적배당형 상품 수익률과 격차가 점점 벌어지고 있기 때문이다.미래에셋증권 퇴직연금계좌 내 ETF 투자 잔액은 2024년 말 8조1000억원에서 지난달 말 16조9600억원으로 1년 만에 2배 이상 늘었다. 퇴직연금 계좌를 통해서는 개별 주식에 직접 투자할 수 없기 때문에 ETF가 주식 투자 수요를 대체하고 있다.김진영 키움증권 연구원은 “퇴직연금은 DB형에서 DC형으로 전환되고 실적배당형 투자 비중이 증가하는 흐름이 가속화되고 있다”며 “퇴직연금 자금 유입이 국내 증시의 하방을 지지하는 요인 중 하나가 됐다”고 평가했다.",2026-02-24
32,"미래에셋證, 6354억어치 배당·자사주 소각…'역대 최대' 규모",https://n.news.naver.com/mnews/article/015/0005254703,"미래에셋증권은 역대 최대 규모인 약 6354억 원 수준의 주주환원을 진행한다고 24일 밝혔다.미래에셋증권은 이날 이사회를 열고 현금 및 주식 배당, 자사주 소각, 신임 사외이사 선임 등을 결의했다.결정된 배당총액은 현금배당 약 1744억 원(보통주 기준 300원), 주식배당 약 2909억 원(보통주 기준 500원 상당 주식)으로 총 4653억 원이다. 이는 이사회 전일 종가 기준으로, 지난해 현금 배당금액 1467억원 대비 3배 이상 규모다. 배당 기준일은 3월 17일이다. 현금 및 주식 배당은 3월 24일 정기주주총회 승인 후 1개월 이내 지급할 계획이다.자사주 소각은 보통주 약 1177만주, 2우선주 약 18만 주를 대상으로 진행한다. 지난해 11월 보통주 및 우선주 약 405만 주 등을 소각한 금액까지 합산하면 약 1701억 원 규모다. 이에 따라 2025 사업연도 총 주주환원 규모는 약 6354억원으로, 당기순이익 약 1.5조 원을 감안했을 때 주주환원 성향은 약 40%다.이날 이사회에서는 신규 사외이사로 안수현 사외이사(감사위원)를 선임하는 안건도 결의했다. 안수현 사외이사 후보자는 현재 한국외국어대학교 법학전문대학원 원장으로, 금융감독원 소비자부문 위원, 디지털자산보호재단 비상임이사 등으로 활동 중인 대표적인 법률·금융소비자보호 전문가다.또한 임직원 책임경영 강화 및 주주 이익 일치를 도모하고자 임직원 주식보상을 위한 자사주 처분안도 결의했다. 보통주 약 20만 주를 주요 직책자 등에게 교부할 예정이다.이외에도 상법 개정에 맞춰 회사 정관을 법령 체계에 맞춰 정비하는 안건도 가결했다. 사외이사 명칭을 독립이사로 변경하고, 전자주주총회 제도를 도입하며, 감사위원 선·해임 시 의결권 제한을 강화한 내용 등이 포함됐다.미래에셋증권 관계자는 “당사는 실적에 맞춰 배당 규모를 역대 최대로 확대하는 한편, 실적의 약 30%가 미실현이익이라는 점과 자본효율성을 제고하는 차원에서 현금배당과 주식배당을 병행했다”며 “보통주 약 1177만 주와 우선주 약 18만 주의 자사주 소각도 함께 진행해 총 발행주식 수는 감소시킬 것이며, 자기자본은 지속적으로 확충하고 상황에 맞는 주주환원정책으로 글로벌 금융그룹으로 성장할 것”이라고 말했다.",2026-02-24
33,"""투자 수익률 1400%""...한국성장금융, 퓨리오사AI 투자로 ‘잭팟’[마켓인]",https://n.news.naver.com/mnews/article/018/0006223884,"한국성장금융이 초기투자한 퓨리오사 AI 3조 밸류로정책형 모험자본 투자 성과 가시화추정 수익률만 1400%대이 기사는 2026년02월24일 17시37분에 마켓인 프리미엄 콘텐츠로 선공개 되었습니다.[이데일리 마켓in 지영의 기자]퓨리오사AI가 3조원 안팎의 기업가치를 기준으로 시리즈D 투자 유치를 추진하면서 초기 투자자들이 막대한 수익을 거둘 전망이다. 특히 초기 투자자들 중 한국성장금융투자운용의 경우 현재 기업가치 기준 최고 1400%대에 달하는 수익률을 기록할 것으로 추정된다.24일 투자은행(IB) 업계에 따르면 퓨리오사AI는 최근 약 2조9000억원 수준의 기업가치를 기준으로 시리즈D 라운드를 진행 중이다. 3조원 가량에서 투자가 마무리되면, 초기 투자자들은 투자 원금의 10배 이상에 달하는 평가 차익을 거둘 것으로 보인다.초기 투자자 중 한국성장금융은 퓨리오사AI의 성장 단계별로 프로젝트 펀드를 통해 자금을 투입했다. 지난 2021년 시리즈B 당시 기업가치 1800억원(프리머니)에 139억5000만원을 투자한 ‘아이온 필로스 펀드’의 경우, 현재 기업가치가 3조원 수준으로 평가될 경우 투자금이 약 15배로 불어나는 셈이다. 누적 수익률로는 1400%를 웃돈다.시리즈C 브릿지 단계에서 기업가치 8300억원(프리머니) 기준 120억원을 추가 투자한 ‘유진 딥테크 펀드’ 역시 현재 기업가치 3조원 기준으로 보면 투자금이 3배 중후반 수준으로 늘어나는 구조다. 단순 수익률로 환산하면 250~270% 수준이다.



높은 수익률을 내게 된 배경에는 자금 조달이 쉽지 않았던 초기 단계 기업에 대한 투자 판단이 있다. 성장금융이 퓨리오사AI에 처음 투자했을 당시 회사는 1세대 AI칩 ‘워보이(Warboy)’의 성능을 입증한 뒤 차세대 제품 개발을 준비하던 시점이었다. 기술 경쟁력은 확보했지만, 본격적인 양산과 글로벌 상용화로 넘어가기에는 추가 자금이 필요한 구간이었다.반도체 산업은 설계 이후 실제 제품 생산과 고객사 인증, 양산 전환까지 상당한 비용이 투입된다. 매출이 본격화되기 전까지 생긴 자금 부족에 쓰러질 수 있는 ‘데스밸리(Death Valley)’ 구간이다. 이 시기에 투입된 자금이 제품 개발과 후속 투자 유치로 이어지며 기업가치 상승의 기반이 됐다는 분석이다.이후 퓨리오사AI는 2세대 AI 반도체 ‘RNGD(레니게이드)’ 개발에 착수했다. RNGD는 HBM3E를 탑재한 고성능 칩으로, 지난 1월 TSMC를 통해 제조된 초도 물량 4000장을 인도받으며 상용화 단계에 진입했다. 생성형 AI와 대규모 언어모델(LLM) 확산으로 데이터센터용 AI 반도체 수요가 급증하는 흐름과 맞물리며 기업가치 재평가로 이어졌다는 평가다.퓨리오사AI 투자 성공사례 외에도 한국성장금융은 국내 반도체 초기 생태계 기업에 투자해 수익을 내는 동시에 기업 성장 기반을 다져온 사례를 여럿 축적해왔다. 국내 AI반도체 생태계의 핵심 기업이 된 리벨리온과 세미파이브 역시 프로젝트 및 블라인드 펀드를 통해 한국성장금융의 초기투자 자금을 유치한 뒤 기술 고도화와 사업 확장을 이어왔다.업계에서는 자금 조달이 쉽지 않은 초기 구간에서의 투자가 기업의 스케일업과 직결된다고 본다. 기술 기업은 양산과 상용화로 넘어가는 과정에서 자금 공백을 겪기 쉽고, 이 시점에 투입된 자금이 기업 성장의 속도를 좌우한다는 설명이다. 한 PEF 업계 관계자는 “퓨리오사AI 사례처럼 초기 단계에서의 투자가 기업가치 상승으로 이어지면 투자 기관은 수익을 거두고 기업은 성장 기반을 확보하는 선순환 구조가 만들어진다”며 “전략 산업일수록 초기 구간에서의 자금 역할이 중요하다”고 말했다.",2026-02-24
34,코스피 시총 5000兆 돌파 '카운트다운',https://n.news.naver.com/mnews/article/014/0005482234,"이달 14% 늘어 4922조7366억반도체업종 강세에 빠르게 급증삼성·하이닉스 비중이 38% 달해 



 코스피 시가총액이 지난달 4000조원을 넘어선 지 한달도 안돼 5000조 돌파를 눈앞에 뒀다. 국내 증시를 주도하고 있는 반도체 업종의 상승세가 지속되면서, 코스피 시총도 가파르게 늘고 있다.  24일 한국거래소에 따르면 이날 장 마감 기준 코스피 시가총액은 4922조7366억원으로 집계됐다. 지난달 말 4318조6471억원에서 이달 들어서만 13.99% 증가한 수치다. 현 수준에서 약 1.6%만 늘어날 경우 5000조원 돌파가 가능해진다. 지난달 한 달 동안 시총이 24.18% 증가한 점을 감안하면, 이르면 이달 내 5000조원을 넘어설 것이란 전망이 나온다.  지난해부터 이어진 증시 호황에 코스피 시총도 급격하게 불어났다. 장 마감 기준 코스피 시총은 지난 2021년 1월 4일 처음으로 2000조원을 넘긴 뒤, 4년 9개월여만인 지난해 10월 15일 3000조원을 돌파했다. 이후 3개월 만인 지난달 16일 4000조원을 넘겼고, 2개월도 되지 않아 5000조원 돌파를 앞두게 됐다.  시가총액 상위 종목 1·2위인 삼성전자와 SK하이닉스의 몸집이 불어난 영향이 컸다. 이날 SK하이닉스 시가총액이 처음으로 700조원대를 돌파하며 삼성전자와 합산 시가총액은 1900조1935억원을 기록했다.  코스피 전체 시총에서 삼성전자와 SK하이닉스가 차지하는 비중도 확대됐다. 2024년 말만 해도 코스피에서 삼성전자·SK하이닉스가 차지하는 비중은 22.62% 수준이었지만, 지난해 말 34.04%에서 현재 38.60%까지 높아졌다.  증권가에선 지난해에 이어 올해도 반도체 업종이 주도주가 될 것으로 보고 있다. 삼성전자와 SK하이닉스에 대한 실적 전망치가 상향 조정되면서, 코스피도 상승세를 이어갈 것이란 전망이다.  올해 삼성전자와 SK하이닉스의 영업이익 전망치는 각각 최대 250조원, 220조원 수준까지 높아진 상황이다. 실적 기대감에 이날 삼성전자는 20만원, SK하이닉스는 100만5000원에 장을 마감하며 최고가를 기록하기도 했다.  설태현 DB증권 연구원은 ""올해와 내년 삼성전자와 SK하이닉스의 영업이익에 대한 증권사별 전망치 분포를 고려할 때, 향후 이익 전망치의 추가적인 상향 조정 가능성에 무게가 실리고 있다""며 ""반도체 대표 기업의 실적 향방은 지수 변동성을 넘어 연내 코스피 밴드 자체를 재정의하는 핵심적인 결정 변수가 될 것""이라고 진단했다.  증권가에선 코스피 예상 밴드도 올려잡고 있다. 하나증권은 코스피 상단을 7870으로 제시하며 가장 높은 전망치를 내놨다. NH투자증권과 키움증권은 7300, 한국투자증권은 7250, 유안타증권은 7100으로, 7000 이상으로 눈높이가 높아지고 있다.  한지영 키움증권 연구원은 ""올해 코스피 영업이익 컨센서스는 약 580조원으로, 연초 대비 약 35% 급증했는데, 추후 600조원 초중반 수준까지 상향될 것으로 보인다""며 ""단기 폭등에 따른 지수 자체의 레벨 부담은 있으나, 선행 주가수익비율(PER)이 역사적 평균인 10배 부근에서 머물러 있는 등 밸류에이션 부담이 낮다는 점을 긍정적으로 볼 필요가 있다""고 분석했다.  풍부한 유동성도 증시 상승에 힘을 싣는 요인이다. 허재환 유진투자증권 연구원은 ""주가 상승의 중요한 동력은 기업 실적과 유동성""이라며 ""올해 들어 지난 11일까지 은행 예금은 34조원 감소한 반면, 주식형 펀드 자금은 46조7000억원, 증권사 고객 예탁금은 10조원 증가했다""고 짚었다.",2026-02-24
35,자사주 소각 효과 속도낸다… 코스피 주식수 3분기째 감소,https://n.news.naver.com/mnews/article/014/0005482233,"이달 20일 기준 632억3159만株작년 6월과 비교하면 4억株 줄어당정 주도 의무화 법안 처리 임박기업들 시행 전부터 발빠른 대응증시 저평가 해소에도 힘 보탤듯 



 코스피 시장의 상장주식 수가 지난해 하반기 이후 감소세로 돌아선 것으로 나타났다. 주주 환원에 선제적으로 나선 기업들이 늘어난 영향이 컸다. 향후 3차 상법 개정안 효과가 지수 추가 상승에 힘을 보탤지 주목된다.  24일 코스콤 CHECK에 따르면 지난 20일 기준 코스피 시장에 상장된 주식 수는 632억3159만주로 집계됐다. 지난해 6월30일 636억4858만주와 비교하면 4억주 가량 줄어든 규모로 3분기 연속 감소세를 이어가고 있다. 올해 들어서만 줄어든 상장주식 수는 8623만주에 이른다.  이러한 흐름은 최근 10년 간의 추세와는 대비된다. 코스피 상장주식 수는 2016년 408억8599만주에서 2022년 633억6826만주로 54.9% 늘었다. 2023년(620억3167만주)에는 소폭 감소했지만, 2024년 631억6264만주로 다시 불어났다.  통상 상장주식 수는 기업들의 유상증자나 기업공개(IPO)는 활발한 반면, 자사주 소각 속도는 더딜 때 증가한다. 한국거래소에 따르면 최근 5년 간 국내 상장기업의 평균 자사주 소각 규모는 매입 금액 대비 절반 수준이었다. 지난 2020년부터 2024년까지 상장사의 자사주 매입금액은 합산 45조원인 반면, 자사주 소각 금액은 25조5000억원에 그쳤다.  변화 흐름이 감지된 것은 정부와 여당이 자사주 소각 의무화를 골자로 한 3차 상법 개정안 도입을 추진한 지난해 하반기부터다. 3차 상법 개정안은 자사주 성격을 '자본'으로 명시하고 있다. 기업이 이미 보유한 자사주를 법 시행 후 18개월 이내에 소각하고, 새로 취득한 자사주는 1년 내에 소각하도록 의무화하는 내용을 담고 있다. 제도 변화에 앞서 자사주 보유 비중이 높은 기업들을 중심으로 소각 움직임이 늘면서 지난해 상장기업의 자사주 소각 금액은 21조4000억원으로, 사상 처음으로 자사주 매입 금액(20조1000억원)을 앞질렀다.  증권가에서는 그간 줄지 않았던 상장주식 수가 한국 주식시장 저평가를 부추긴 것으로 보고 있다. 기업 전체 순이익을 상장주식 수로 나눠 계산하는 코스피 주당순이익(EPS)은 주식시장 수익성 지표로 해석된다. 상장주식 수가 많을수록 분모가 커져 주당순이익(EPS)은 낮아지는 구조다. 김종영 NH투자증권 연구원은 ""코스피 상장기업 합계 주식 수는 연평균 약 2% 증가한 반면, 순이익은 연평균 10.5% 성장해 주식 수 희석으로 EPS 성장률이 순이익 증가 속도를 밑돌아왔다""고 말했다.  전날(23일) 국회 법제사법위원회 전체 회의를 통과한 3차 상법 개정안이 본회의 처리를 앞둔 가운데 시장 전문가들은 자사주 소각 의무화가 주식 수 감소를 유도해 증시에 추가 탄력을 제공할 것으로 보고 있다.  이상헌 iM증권 연구원은 ""자기자본이익률(ROE)이 오르면 주가순자산비율(PBR)이, PBR이 오르면 지수가 상승한다""며 ""이때 ROE는 당기순이익을 자본으로 나눈 값인데, 자사주 소각이 의무화되면 자본이 줄면서 ROE가 상승하는 효과가 발생해 결과적으로 지수 상승으로 이어질 수 있다""고 말했다. 이어 ""앞으로 시장은 자사주 매입을 곧 소각 시그널로 받아들이게 돼 기업으로선 주주환원 정책을 더 강화할 수 있는 환경이 조성된 셈""이라고 덧붙였다.",2026-02-24
