,기사제목,본문url,기사본문,date
12,"코스피, '6천피 시대' 개막…장중 5,000 돌파 한달만 쾌거(종합)",https://n.news.naver.com/mnews/article/001/0015922761,"외인·기관 '쌍끌이' 순매도에도 개미 '사자'로 지수 상승 견인삼성전자·SK하이닉스 동반 강세…코스닥, 상승 출발 후 하락 전환



코스피 6,000 시대 개막(서울=연합뉴스) 김성민 기자 = 코스피가 장중 6,000을 넘어선 25일 서울 중구 하나은행 본점 딜링룸에서 직원들이 세리머니를 펼치고 있다.     이날 코스피는 전 거래일보다 53.06포인트(0.89%) 오른 6,022.70로 개장해 사상 처음으로 6,000선을 돌파했다. 2026.2.25 ksm7976@yna.co.kr    (서울=연합뉴스) 고은지 기자 = 코스피가 25일 사상 처음으로 장중 6,000선을 돌파했다.    미국 기술주 강세가 대외 불안에도 거침없이 질주해온 국내 증시에 촉매제 역할을 했다.    이날 오전 9시 19분 현재 코스피는 전장보다 34.89포인트(0.58%) 상승한 6,004.53에 거래되고 있다.    지수는 전장 대비 53.06포인트(0.89%) 오른 6,022.70으로 시작하며 개장과 동시에 '6천피'(코스피 6,000포인트)를 달성했다.    이로써 지난 1월 22일 장중 5,019.54로 '5천피'을 넘어선 지 불과 한 달여 만에 1,000포인트 넘게 오르며 역사를 새로 썼다.    서울 외환시장에서 달러 대비 원화 환율을 전날보다 0.9원 내린 1,441.6원에 개장했다.    유가증권시장에서 외국인과 기관은 각각 5천287억원, 3천143억원을 순매도하고 있지만, 개인이 8천291억원을 순매수하며 지수를 끌어올리는 중이다.    외국인은 코스피200선물시장에서도 2천956억원 매도 우위다.    간밤 뉴욕증시는 3대 주가지수가 모두 반등했다.    24일(미국 동부시간) 뉴욕증권거래소(NYSE)에서 다우존스30산업평균지수는 전장보다 370.44포인트(0.76%) 오른 49,174.50에 거래를 마감했다.    스탠더드앤드푸어스(S&P) 500지수는 전장보다 52.32포인트(0.77%) 상승한 6,890.07, 나스닥종합지수는 236.41포인트(1.04%) 뛴 22,863.68에 장을 마쳤다.    인공지능(AI) 침공의 '선봉장'으로 여겨지던 앤트로픽이 일부 기술 기업들과 파트너십을 발표하면서 AI에 대체되기보다는 AI와 공존할 수 있을 것이라는 기대감이 주가를 띄웠다.



삼성전자·SK하이닉스[연합뉴스 자료사진]    국내 증시도 기술주를 중심으로 강세를 나타내며 '6천피 시대'라는 새로운 역사를 열었다.    삼성전자는 1.00% 오른 20만2천원, SK하이닉스는 0.30% 상승한 100만8천원에 거래 중이다.    이외 시가총액 상위종목 가운데 현대차(4.77%), 기아(10.92%), 두산에너빌리티(0.20%)는 오르고 있고, LG에너지솔루션(-0.73%), 삼성바이오로직스(-0.06%), 한화에어로스페이스(-2.18%)는 내리고 있다.    업종별로는 건설(3.40%), 운송장비·부품(2.53%), 전기·전자(0.55%) 등은 상승하고 있고, 화학(-1.00%), 제약(-0.85^), 의료·정밀기기(-0.55%) 등은 떨어지고 있다.    키움증권 한지영 연구원은 ""최근 코스피는 미국발 역풍에도 고유의 상방 요인에 힘입어 전 세계 대장주 지위를 유지 중""이라며 ""6,000을 넘어 그 이상의 지수 레벨업(상승)을 기대하는 분위기가 조성돼 있다""고 말했다.    같은 시각 코스닥 지수는 전장보다 2.25포인트(0.19%) 내린 1,162.75다.    지수는 전장 대비 9.27포인트(0.80%) 오른 1,174.27로 출발했으나 하락세로 돌아섰다.    코스닥 시장에서 개인은 1천455억원을 순매수하고 있는 반면에 외국인과 기관은 각각 1천112억원 269억원 매도 우위다.    에코프로(0.24%), 케어젠(0.59%)은 상승 중이고, 알테오젠(-1.35%), 에코프로비엠(-0.82%), 삼천당제약(-0.82%)은 하락 중이다.



이제 코스피 6000 시대(서울=연합뉴스) 김성민 기자 = 코스피가 장중 6000을 넘어선 가운데 25일 서울 중구 하나은행 본점 딜링룸에서 직원들이 기뻐하고 있다.     이날 코스피는 전 거래일보다 53.06포인트(0.89%) 오른 6,022.70로 개장해 사상 처음으로 6,000선을 돌파했다. 2026.2.25 ksm7976@yna.co.kr    eun@yna.co.kr",2026-02-25
13,"미래에셋 ‘TIGER 은행고배당플러스TOP10’, 주당 분배금 인상",https://n.news.naver.com/mnews/article/009/0005641569,"미래에셋자산운용은 ‘TIGER 은행고배당플러스TOP10 상장지수펀드(ETF)’의 주당 분배금을 상장 이후 최고 수준으로 지급할 계획이라고 25일 밝혔다.해당 ETF는 이번달 주당 87원의 분배금을 지급할 예정이다. 지난달 73원이던 분배금은 87원까지 확대됐다. 편입 종목들의 배당소득 분리과세 기대가 부각되면서 상장 이후 수익률 212.33%를 기록하고 있다.이 같은 분배금 증가와 성과 흐름에 힘입어 해당 ETF로 자금 유입도 이어지고 있다. 전날 기준 순자산은 9973억원을 기록하고 있다. 1년 전과 비교하면 순자산 규모는 3배 이상 성장했다.은행주를 중심으로 한 금융업종에 대한 관심이 높아지는 배경에는 주주환원 정책 확대에 대한 기대가 자리하고 있다. 3차 상법 개정안 논의가 본격화되면서 은행·증권·보험 등 금융업 전반에서 주주가치 제고를 위한 환원 정책 강화 가능성이 부각되고 있다. 특히 은행 업종은 안정적인 이익 창출 구조를 바탕으로 자사주 매입과 배당 확대 등 다양한 주주환원 수단을 활용할 수 있는 여력이 있다는 평가다.배당소득 분리과세 제도 도입이 투자 환경에도 긍정적인 영향을 미치고 있다. 배당소득 분리과세는 일정 요건을 충족한 기업의 배당에 대해 종합과세 대신 분리과세를 적용하는 제도로, 고배당 정책을 유지·확대하는 기업일수록 투자자에게 보다 유리한 세제 구조가 적용될 수 있다. 이에 따라 주주환원 성향이 높은 은행주 전반의 투자 매력이 부각되면서 관련 ETF에 대한 관심도 확대되는 모습이다.‘TIGER 은행고배당플러스TOP10 ETF’는 KB금융, 신한지주, 하나금융지주, 우리금융지주 등 주요 은행주를 중심으로 보험·증권주까지 포함한 10개 종목에 투자하는 상품이다. 주주환원 정책에 적극적인 종목을 선별해 편입하는 전략을 통해 분배금 증가 흐름을 보이고 있다. 해당 ETF를 이날까지 매수한 투자자는 다음달 4일 분배금을 받을 수 있다.정의현 미래에셋자산운용 ETF운용본부 본부장은 “TIGER 은행고배당플러스TOP10 ETF 편입 종목 10개 중 9개가 배당소득 분리과세 기준을 충족하고 있다”며 “해당 ETF는 국내 주식형 ETF 가운데서도 주주환원에 가장 적극적인 종목을 선별해 투자하는 상품”이라고 말했다.",2026-02-25
14,셋 둘 하나 개장!…'꿈의 6000피' 시대 활짝 열렸다,https://n.news.naver.com/mnews/article/018/0006224133,"코스피, 사상 첫 6000선 돌파…5000피 달성 한달 만에 새 역사6022.70에 출발…6039.18까지 치솟아20만전자·100만닉스 안착…상승 지속“차익실현 압력에도 美증시 반등 효과”[이데일리 김경은 기자] 코스피 지수가 사상 처음으로 6000선을 돌파하며 전인미답의 고지에 올랐다. 지난달 22일 장중 5000선을 처음 넘어선지 약 한 달 만에 꿈의 ‘6000피’ 시대를 열게 됐다.



코스피 지수가 장 시작과 함께 6000포인트를 돌파한 25일 오전 서울 중구 하나은행 본점 딜링룸에서 직원들이 6000포인트 돌파를 축하하고 있다.(사진=뉴스1)25일 엠피닥터에 따르면 이날 오전 9시 3분 기준 코스피는 전 거래일 대비 55.41포인트(0.93%) 오른 6025.05에 거래되고 있다.지수는 이날 전장 대비 53.06포인트(0.89%) 상승한 6022.70에 출발하며 개장 직후 6000선을 넘어섰다. 장중 한때는 전 거래일 대비 1.16% 오른 6039.18까지 치솟았다.투자자별로 개인이 1조1265억원을 순매수했고 외국인과 기관이 각각 6839억원, 4507억원을 순매수했다.업종별로는 건설, 운송장비·부품, 증권, 전기·가스, 전기·전자 등이 강세다. 특히 반도체 대장주는 연일 상승 흐름을 이어가고 있다.이 시각 삼성전자(005930)는 전장 대비 3500원(1.75%) 오른 20만3500원에, SK하이닉스(000660)는 5000원(0.50%) 상승한 101만원에 거래되고 있다.간밤 미국 뉴욕증시에서 인공지능(AI) 및 반도체 관련주가 강세를 보이면서 훈풍이 유입되는 것으로 해석된다. 24일(미 동부시간) 뉴욕증시에서 필라델피아 반도체지수는 1.45% 상승했다. 메타가 AMD와 총 1000억달러(약 144조원)가 넘는 초대형 계약을 맺은 점이 호재로 작용했다.한지영 키움증권 연구원은 “이날 국내 증시는 엔비디아 실적 대기심리 속 전일 급등에 따른 차익실현 압력이 상존하겠다”면서도 “AI 산업 불안 완화 등에 따른 미국 증시 반등 효과에 힘입어 장중 6000포인트 돌파를 시도할 전망”이라고 말했다.이밖에 시가총액 상위 종목 중 현대차(005380)(4.96%), LG에너지솔루션(373220)(0.24%), SK스퀘어(402340)(1.78%) 등이 상승세다. 반면 삼성바이오로직스(207940)(-0.23%), 한화에어로스페이스(012450)(-1.29%), HD현대중공업(329180)(-0.17%) 등은 하락세다. 같은 시각 코스닥 지수는 전 거래일 대비 6.74포인트(0.58%) 오른 1171.74에 거래 중이다. 지수는 전장 대비 9.27포인트(0.80%) 오른 1174.27에 출발했으나 시가를 넘어서지 못하고 있다. 투자자별로 개인이 2703억원을 순매수했고 외국인과 기관이 각각 2360억원, 215억원을 순매도했다. 시총 상위 2개 종목의 흐름은 엇갈렸다. 에코프로(086520)는 전 거래일 대비 700원(0.41%) 오른 17만600원에, 알테오젠(196170)은 5500원(1.35%) 하락한 40만2500원에 거래되고 있다.이밖에 에코프로비엠(247540)(-0.47%), 삼천당제약(000250)(-0.98%), 레인보우로보틱스(277810)(-0.14%), 에이비엘바이오(298380)(-1.32%), 코오롱티슈진(950160)(-1.35%) 등 상위 종목 대다수가 하락세다. 반면 리노공업(058470)(0.21%), 케어젠(214370)(0.95%) 등은 상승세다.",2026-02-25
15,코스피 6000 시대 개막…5000 돌파 한 달 만에 새 기록,https://n.news.naver.com/mnews/article/629/0000475388,"개인 3800억원 순매수…지수 견인반도체·자동차 대형주 강세 지속



25일 한국거래소에 따르면 오전 9시 1분 기준 코스피는 전 거래일 대비 1.07%(63.66포인트) 오른 6033.30에 거래되고 있다. /뉴시스[더팩트ㅣ박지웅 기자] 코스피가 사상 처음으로 6000선을 돌파하며 국내 증시가 새 이정표를 세웠다. 지난달 27일 종가 기준 5000선(5084.85)을 넘어선 이후 약 한 달 만이다. 지수 1000포인트 상승을 단기간에 달성하면서 상승 탄력이 이어지고 있다는 평가가 나온다.25일 한국거래소에 따르면 오전 9시 1분 기준 코스피는 전 거래일 대비 1.07%(63.66포인트) 오른 6033.30에 거래되고 있다. 장 초반 매수세가 집중되며 6000선을 단숨에 돌파했다. 수급은 개인이 주도하고 있다. 외국인과 기관이 각각 2935억원, 927억원 순매도 중이지만 개인이 3801억원 순매수하며 지수를 견인하고 있다.시가총액 상위 종목은 대체로 상승세다. 삼성전자(1.50%), SK하이닉스(1.00%), 삼성전자우(1.77%) 등 반도체 대형주가 강세를 보이고 있으며, 현대차(4.01%), 기아(3.85%) 등 자동차주도 오름폭을 확대하고 있다. SK스퀘어(2.51%), 두산에너빌리티(0.99%)도 상승 중이다. 반면 LG에너지솔루션(-0.36%), 삼성바이오로직스(-0.06%), 한화에어로스페이스(-1.13%) 등 일부 종목은 약세를 나타내고 있다.코스닥도 동반 상승세다. 같은 시각 코스닥 지수는 전 거래일 대비 0.48%(5.64포인트) 오른 1170.64를 기록하고 있다. 외국인과 기관이 각각 688억원, 159억원 순매도하는 가운데 개인이 878억원 순매수하며 지수를 지탱하고 있다. 에코프로(1.24%), 에코프로비엠(0.47%), 삼천당제약(0.65%), 리노공업(1.03%) 등은 오르고 있으며, 알테오젠(-0.55%), 에이비엘바이오(-0.63%), HLB(-0.38%) 등은 하락 중이다.전문가들은 최근 지수 급등 흐름이 단순 단기 반등을 넘어 이익 모멘텀에 기반한 상승이라는 점에 주목하고 있다. 한지영 키움증권 연구원은 ""1월 말 5000선을 돌파한 이후 2주가량 숨 고르기 기간을 거친 뒤 다시 급등 랠리를 전개하며 2월 말 현재 5800선을 넘어섰다""고 설명했다.이어 ""블룸버그가 집계한 코스피의 12개월 목표 지수 컨센서스는 현재 6500선 수준""이라며 ""한국 증시의 이익 모멘텀이 상대적으로 우위에 있는 만큼 단기 지수 부담을 이유로 성급하게 비관론으로 전환하는 전략은 지양할 필요가 있다""고 밝혔다.시장에서는 반도체 업황 개선 기대와 자동차·2차전지 등 주력 업종 실적 모멘텀, 개인 자금 유입이 복합적으로 작용하며 지수 상단을 끌어올리고 있다는 분석이 나온다. 다만 단기 급등에 따른 차익 실현 매물 가능성과 외국인 수급 변화는 변동성 요인으로 지목된다.한편 서울 외환시장에서 원·달러 환율은 전 거래일 대비 0.9원 내린 1441.6원에 개장했다.발로 뛰는 더팩트는 24시간 여러분의 제보를 기다립니다.▶카카오톡: '더팩트제보' 검색▶이메일: jebo@tf.co.kr▶뉴스 홈페이지: http://talk.tf.co.kr/bbs/report/write",2026-02-25
16,"오지급에 지분규제 덮쳐 기로에 선 코인거래소[Who, What, Why]",https://n.news.naver.com/mnews/article/021/0002773036,"■ What - 가상자산거래소 회의론‘자산 10조원 대기업’ 두나무2019년 北해킹에 580억 털려빗썸은 60조원대 코인 오지급내부 통제체계 부실 논란 커져대주주 지분 제한 법안도 가속업계선 디지털 혁신 전망 여전네이버-업비트 등 합병 시너지원화 코인 제도화 기대도 확산







가상자산 시장의 급속한 성장에 발맞춰 몸집을 불려 온 국내 가상자산 거래소들이 사면초가(四面楚歌)의 위기에 빠졌다. 지난해 말부터 비트코인 등 주요 가상자산 시세가 급락하면서 ‘디지털 금’ 서사에 대한 회의론이 커졌고, 증시 활황과 맞물리며 투자자들의 관심이 줄어 거래대금 가뭄으로 이어졌다. 2위 거래소인 빗썸에선 무려 60조 원 규모의 비트코인 오지급 사태가 발생하면서 신뢰성까지 타격을 입었다. 디지털자산기본법(2단계 입법)에 포함이 유력한 대주주 지분 제한 규정도 또 다른 걸림돌로 떠올랐다.하지만 위기의 또 다른 얼굴은 곧 기회이기도 하다. 자산의 디지털화와 스테이블코인 제도화를 둘러싸고 금융 혁신이 가속화하는 현재 가상자산 분야는 여전히 성장 잠재력이 가장 큰 시장이다. ‘크립토 윈터’(가상자산 겨울)가 지나고 나면 직전 고점 이상으로 시세가 뛰어오를 것으로 점치는 투자자들도 적잖다. 금융 혁신의 선두주자로 도약하느냐, 한때의 유행으로 흘러가느냐. 현재 가상자산 거래소들 앞에 놓인 두 개의 갈림길이다.◇창업 10년 만에 재계 순위권으로= 5대 원화 가상자산 거래소(업비트·빗썸·코인원·코빗·고팍스) 가운데 국내 1위 가상자산 거래소 업비트를 운영하는 두나무는 2012년 창립한 뒤 불과 10년 만인 2022년 자산총액 10조 원을 넘기며 대기업으로 발돋움했다. 처음에는 증권거래 정보 서비스 ‘증권플러스’로 출발했지만, 2017년 10월 미국 비트렉스와 독점 제휴를 맺고 업비트를 출범시키며 다음 해 빗썸을 추월하고 선두에 올랐다. 급속한 성장에 따른 사건·사고도 뒤따랐다. 2019년엔 북한 해킹 조직이 업비트를 해킹해 시가 580억 원 상당의 가상자산을 탈취하는 사고가 발생했다. 지난해 2월 금융정보분석원(FIU)으로부터 ‘가상자산에 관한 특정 금융거래정보의 보고 및 이용 등에 관한 법률’(특금법) 위반으로 영업 일부정지 3개월 처분을 받았는데, 법원은 집행정지 신청을 인용해 효력 집행에 제동을 걸었다.◇대형 금융사고로 암초 만나= 2위 빗썸은 업비트 이전부터 가상자산 시장을 주도해 온 거래소다. 2013년 말 비트코인 거래소 ‘엑스코인’을 시작으로 2015년 7월 현재의 이름으로 바꾸고 2017년엔 전 세계 거래대금 1위를 달성하기도 했다. 다만 지난 6일 벌어진 비트코인 오지급 사태가 일파만파 커지면서 금융권을 뒤흔드는 초대형 이슈로 번졌다. 금융당국이 검사 기간을 이달 말까지로 연장한 상황이라 추가 오지급 사례 지적과 내부통제 부실 문제로 이어질 수 있다는 관측이 나온다.업비트·빗썸의 양강 구도 속에 다른 거래소들도 제각기 강점을 바탕으로 시장 판도를 뒤흔들 채비를 갖추고 있다. 코인원은 2014년 설립 이후 2016년 고위드(전 데일리금융그룹)에 인수됐고, 2017년 옐로모바일그룹 계열사 편입을 거쳐 국내외 기업들과 협력을 타진하는 등 성장 드라이브에 새롭게 시동을 걸고 있다. 국내 최초 가상자산 거래소로 2013년 문을 연 코빗은 글로벌 게임사 넥슨의 모회사 NXC에 인수돼 계열사가 됐고 현재 미래에셋그룹이 인수를 진행하고 있다. 5위 고팍스는 가상자산 예치 서비스 고파이를 통해 고객 자산을 해외 운용사에 맡겼다가 운용사 파산으로 대규모 미지급금이 발생한 ‘고파이 사태’로 위기를 겪었지만, 지난해 세계 최대 가상자산 거래소 바이낸스가 금융당국으로부터 고팍스 인수를 최종 승인받으면서 반등을 노리고 있다.◇시장 위축에 규제 리스크까지= 성장을 거듭하던 거래소들도 지난해 말부터 찾아온 ‘크립토 윈터’의 한파를 피하진 못하고 있다. 코인마켓캡 기준 지난해 10월 최대 4조2000억 달러에 달했던 가상자산 시가총액은 현재 2조2000억 달러 수준으로 축소됐고, 12만6000달러를 넘어섰던 비트코인 시세는 현재 6만5000달러 안팎을 횡보하고 있다. 대규모 레버리지 청산 사태 이후 미국 현물 비트코인 상장지수펀드(ETF)에서 기관 자금이 이탈했다. 빗썸 오지급 사태를 계기로 당국의 규제도 강화되는 분위기다. 국회 정무위원회에서 가상자산 2단계 법안이 입법을 앞두고 있는데, 가상자산 거래소의 대주주 지분을 15∼20%로 제한하는 내용이 시장 전체를 뒤흔들 수 있는 뇌관으로 부상했다. 당국과 여당 등에선 자본시장법상 대체거래소(ATS)의 대주주 지분 한도 15% 규정처럼 가상자산 거래소 대주주 지분율을 제한, 투명성과 공공성을 제고하겠다는 입장이다. 반면 가상자산 거래소 협의체(DAXA)와 한국핀테크산업협회 등 업계는 금융시장 혁신을 가로막는 과잉규제라며 반발하고 있다. 위험을 감수하며 사업을 키워 낸 창업자들의 재산권을 침해하는 위헌적 조치일 뿐 아니라 투자 유치와 혁신 동력을 위축시킬 수 있다는 논리다.지분 규제가 현실화할 경우 5대 거래소 모두 대주주가 지분을 매각해야 할 수 있다. 더 큰 문제는 진행 중인 인수·합병에 미칠 영향이다. 네이버파이낸셜과 업비트 운영사 두나무의 합병안에 따르면 네이버파이낸셜이 두나무를 포괄적 주식교환 방식으로 인수하게 되는데, 지분율 제한이 법제화될 경우 완전 자회사 편입이 불가능해질 수 있다.다만 비관만 하기엔 이르다는 관측도 나온다. 실제 합병이 성사돼 네이버페이의 간편결제 생태계와 업비트의 가상자산 유통 능력이 결합하면 원화 기반 스테이블코인 도입 등에 발맞춰 디지털 금융의 선두주자로 나설 것으로 기대된다. 빗썸은 최근 핀테크 기업 아톤과 ‘양자내성암호(PQC) 보안 솔루션 도입을 위한 기술협약’을 체결해 PQC 기반 보안 체계를 도입하는 등 보안 강화에 나섰다. 미래에셋 품에 안기는 코빗, 바이낸스를 등에 업은 고팍스가 가져올 시너지 효과도 주목된다.",2026-02-25
17,"엔켐, 실리콘 복합 음극재용 전해액 개발 확대",https://n.news.naver.com/mnews/article/014/0005482363,"실리콘 음극 전환 대비한 전해액 평가 본격화新구조 전지에서 100% 실리콘 음극 전해액 개발 완료음극재 시장 성장 속 기술 선점 경쟁 가속 



미국 조지아주에 위치한 엔켐 조지아공장 전경. 엔켐 제공. [파이낸셜뉴스] 이차전지 핵심소재 전해액 기업 엔켐이 실리콘 복합 음극재(Si-Anode)용 전해액 개발을 확대하며 차세대 배터리 시장 대응에 속도를 내고 있다.  엔켐은 실리콘 함량에 따라 단계별 전해액 라인업을 구축했다고 25일 밝혔다. 실리콘 비중 5% 이하의 1단계부터 5~10%의 2단계, 10~15%의 3단계, 15~30%의 4단계, 30% 이상의 5단계까지 대응 가능한 제품을 개발해 전지 평가에 활용 중이다. 해당 전해액은 북미, 한국, 중국, 일본 등 글로벌 전기차 및 배터리 셀 제조사를 중심으로 상용화 또는 평가 단계에 있으며, 실리콘 복합 음극재 적용 비율 확대를 위한 검증이 이뤄지고 있다.  현재 실리콘 복합 음극재는 기존 그래파이트(흑연) 음극재를 일부 대체하는 방식으로 채택이 검토되고 있다. 전기차 시장이 중·대형 중심으로 확대되고 저가형 전기차에서는 리튬·인산철(LFP) 배터리 비중이 높아지는 환경을 고려할 때 내구성과 수율이 검증된 그래파이트 음극재의 비중은 당분간 유지될 가능성이 크다고 회사 측은 예상했다.  다만 실리콘 음극재는 기존 흑연 대비 에너지 밀도가 높아 전기차 주행거리를 늘리고 충전 속도를 단축할 수 있는 장점을 갖고 있다.  이에 따라 글로벌 주요 배터리 제조사와 완성차 업체를 중심으로 고에너지밀도 전기차 수요가 이어지고 있으며, 피지컬AI 로봇 산업용 전지 시장까지 새롭게 형성되면서 실리콘 복합 음극재 비중 확대를 전제로 한 평가가 활발히 진행되고 있다.  엔켐은 카본 기반 실리콘 복합재(Si-C)와 산화물 기반 실리콘 음극재(Si-Ox)에 모두 적용 가능한 전해질 조성을 확보했다. 이미 다수의 완성차(OEM) 및 전지사에 실리콘 음극재 1단계, 2단계 적용 전해액을 공급 중이다. 또한 팽창 특성을 고려해 셀 구조를 변경한 신구조 전지에서 100% 실리콘 음극에 대응하는 전해액 개발도 완료한 것으로 알려졌다.  이 같은 기술력을 기반으로 엔켐은 지난해 12월 북미 실리콘 배터리 기업과 3년간 1000톤 규모 전해액 공급 계약을 추진하고 있다. 실리콘 100% 음극재 상용화 초기 단계에서 실제 공급 계약으로 이어지고 있다는 점에서 기술 검증을 넘어 사업화 단계에 진입했다는 평가가 나온다.  엔켐 관계자는 “대규모 양산 경쟁 속에서도 세계 점유율 확대와 함께 특정 타깃 전지 시장을 공략하는 맞춤형 전해액 개발 전략을 유지하고 있다”며 “실리콘 복합 음극재가 소량 적용된 전지 상용화에 이어 단계별 비중 확대가 본격 채택되는 시점에 대비해 기술 축적과 고함량 대응 역량을 동시에 강화하고 있다”고 언급했다.",2026-02-25
